{
  "unit": "mm",
  "engine": {
    "name": "manufacturing",
    "version": "0.3.0"
  },
  "specEngine": {
    "name": "patterning",
    "version": "0.1.0"
  },
  "garment": {
    "type": "straight-skirt"
  },
  "pieces": [
    {
      "panelId": "front",
      "name": "Devant",
      "quantity": 1,
      "cutOnFold": true,
      "cutLine": [
        [
          0.0,
          -30.0
        ],
        [
          260.0,
          -30.0
        ],
        [
          260.0,
          402.02
        ],
        [
          259.98,
          405.8
        ],
        [
          259.93,
          409.58
        ],
        [
          259.84,
          413.34
        ],
        [
          259.71,
          417.08
        ],
        [
          259.55,
          420.81
        ],
        [
          259.35,
          424.52
        ],
        [
          259.11,
          428.2
        ],
        [
          258.84,
          431.87
        ],
        [
          258.53,
          435.53
        ],
        [
          258.18,
          439.16
        ],
        [
          257.8,
          442.77
        ],
        [
          257.38,
          446.37
        ],
        [
          256.92,
          449.95
        ],
        [
          256.43,
          453.51
        ],
        [
          255.9,
          457.05
        ],
        [
          255.33,
          460.57
        ],
        [
          254.73,
          464.07
        ],
        [
          254.09,
          467.55
        ],
        [
          253.41,
          471.02
        ],
        [
          252.7,
          474.47
        ],
        [
          251.95,
          477.89
        ],
        [
          251.16,
          481.3
        ],
        [
          250.34,
          484.69
        ],
        [
          249.48,
          488.06
        ],
        [
          248.58,
          491.41
        ],
        [
          247.65,
          494.75
        ],
        [
          246.68,
          498.06
        ],
        [
          245.67,
          501.35
        ],
        [
          244.62,
          504.63
        ],
        [
          243.54,
          507.88
        ],
        [
          242.42,
          511.12
        ],
        [
          241.27,
          514.34
        ],
        [
          240.07,
          517.54
        ],
        [
          238.84,
          520.71
        ],
        [
          237.58,
          523.87
        ],
        [
          236.27,
          527.01
        ],
        [
          234.93,
          530.13
        ],
        [
          233.55,
          533.23
        ],
        [
          232.14,
          536.31
        ],
        [
          230.69,
          539.37
        ],
        [
          229.2,
          542.41
        ],
        [
          227.68,
          545.43
        ],
        [
          226.11,
          548.43
        ],
        [
          224.52,
          551.41
        ],
        [
          222.88,
          554.37
        ],
        [
          221.21,
          557.31
        ],
        [
          219.5,
          560.23
        ],
        [
          217.75,
          563.13
        ],
        [
          215.97,
          566.01
        ],
        [
          214.15,
          568.87
        ],
        [
          212.3,
          571.71
        ],
        [
          210.41,
          574.53
        ],
        [
          208.48,
          577.33
        ],
        [
          206.52,
          580.11
        ],
        [
          204.51,
          582.86
        ],
        [
          202.48,
          585.6
        ],
        [
          200.4,
          588.32
        ],
        [
          198.29,
          591.01
        ],
        [
          196.15,
          593.69
        ],
        [
          193.97,
          596.34
        ],
        [
          191.75,
          598.98
        ],
        [
          189.49,
          601.59
        ],
        [
          187.2,
          604.18
        ],
        [
          181.94,
          610.0
        ],
        [
          0.0,
          610.0
        ]
      ],
      "seamLine": [
        {
          "edgeId": "hem",
          "role": "hem",
          "allowanceMm": 30,
          "points": [
            [
              0.0,
              0.0
            ],
            [
              250.0,
              0.0
            ]
          ]
        },
        {
          "edgeId": "side-lower",
          "role": "seam",
          "allowanceMm": 10,
          "points": [
            [
              250.0,
              0.0
            ],
            [
              250.0,
              402.0
            ]
          ]
        },
        {
          "edgeId": "side-upper",
          "role": "seam",
          "allowanceMm": 10,
          "points": [
            [
              250.0,
              402.0
            ],
            [
              249.98,
              405.7
            ],
            [
              249.93,
              409.39
            ],
            [
              249.84,
              413.05
            ],
            [
              249.72,
              416.7
            ],
            [
              249.56,
              420.32
            ],
            [
              249.36,
              423.93
            ],
            [
              249.13,
              427.51
            ],
            [
              248.87,
              431.08
            ],
            [
              248.57,
              434.63
            ],
            [
              248.23,
              438.16
            ],
            [
              247.86,
              441.67
            ],
            [
              247.45,
              445.16
            ],
            [
              247.01,
              448.63
            ],
            [
              246.53,
              452.08
            ],
            [
              246.02,
              455.51
            ],
            [
              245.47,
              458.92
            ],
            [
              244.88,
              462.32
            ],
            [
              244.27,
              465.69
            ],
            [
              243.61,
              469.05
            ],
            [
              242.92,
              472.38
            ],
            [
              242.19,
              475.7
            ],
            [
              241.43,
              479.0
            ],
            [
              240.64,
              482.27
            ],
            [
              239.8,
              485.53
            ],
            [
              238.94,
              488.77
            ],
            [
              238.03,
              491.99
            ],
            [
              237.1,
              495.19
            ],
            [
              236.12,
              498.37
            ],
            [
              235.11,
              501.53
            ],
            [
              234.07,
              504.67
            ],
            [
              232.99,
              507.8
            ],
            [
              231.88,
              510.9
            ],
            [
              230.72,
              513.98
            ],
            [
              229.54,
              517.05
            ],
            [
              228.32,
              520.09
            ],
            [
              227.06,
              523.12
            ],
            [
              225.77,
              526.13
            ],
            [
              224.44,
              529.11
            ],
            [
              223.08,
              532.08
            ],
            [
              221.68,
              535.03
            ],
            [
              220.25,
              537.96
            ],
            [
              218.78,
              540.87
            ],
            [
              217.27,
              543.76
            ],
            [
              215.73,
              546.63
            ],
            [
              214.16,
              549.48
            ],
            [
              212.55,
              552.32
            ],
            [
              210.9,
              555.13
            ],
            [
              209.22,
              557.93
            ],
            [
              207.5,
              560.7
            ],
            [
              205.75,
              563.46
            ],
            [
              203.96,
              566.19
            ],
            [
              202.14,
              568.91
            ],
            [
              200.28,
              571.61
            ],
            [
              198.39,
              574.28
            ],
            [
              196.46,
              576.94
            ],
            [
              194.49,
              579.58
            ],
            [
              192.49,
              582.2
            ],
            [
              190.46,
              584.8
            ],
            [
              188.39,
              587.38
            ],
            [
              186.28,
              589.95
            ],
            [
              184.14,
              592.49
            ],
            [
              181.96,
              595.01
            ],
            [
              179.75,
              597.52
            ],
            [
              177.5,
              600.0
            ]
          ]
        },
        {
          "edgeId": "waist",
          "role": "waistline",
          "allowanceMm": 10,
          "points": [
            [
              177.5,
              600.0
            ],
            [
              0.0,
              600.0
            ]
          ]
        },
        {
          "edgeId": "fold",
          "role": "fold",
          "allowanceMm": 0,
          "points": [
            [
              0.0,
              600.0
            ],
            [